{
  "kind": "CGKNProjectGenerationBenchmarkCaseCatalog",
  "schema_version": "1.0.0",
  "benchmark_id": "CGKN_PROJECT_GENERATION_BENCHMARK_V1",
  "cases": [
    {
      "case_id": "CASE_01_CSV_DATA_CLEANER", "level": "L1", "title": "CSV Data Cleaner",
      "user_goal": "帮我做一个本地工具，可以导入 CSV，自动处理空值、重复行和明显格式问题，让我预览清洗前后差异，最后导出清洗后的 CSV。",
      "allowed_assumptions": ["UTF-8 CSV input", "A single local user", "No cloud service is required"],
      "hard_requirements": [{"id":"R1","description":"Import a CSV file"},{"id":"R2","description":"Remove duplicate rows"},{"id":"R3","description":"Handle and report missing values"},{"id":"R4","description":"Preview before-and-after differences"},{"id":"R5","description":"Export a cleaned CSV"},{"id":"R6","description":"Handle malformed input without silent corruption"}],
      "hidden_acceptance": [{"id":"csv.clean","category":"functional","description":"A real process imports a mixed CSV and removes duplicates","hard":true,"requirement_ids":["R1","R2"]},{"id":"csv.missing","category":"functional","description":"Missing values are handled and reported","hard":true,"requirement_ids":["R3"]},{"id":"csv.preview","category":"functional","description":"Observed output presents a before-and-after preview","hard":true,"requirement_ids":["R4"]},{"id":"csv.malformed","category":"functional","description":"Malformed input is explicitly reported","hard":true,"requirement_ids":["R6"]},{"id":"csv.runtime","category":"runtime","description":"Documented local entry point starts and exits correctly","hard":true,"requirement_ids":["R1"]},{"id":"csv.persist","category":"persistence","description":"The emitted CSV remains readable after the cleaner process exits","hard":true,"requirement_ids":["R5"]},{"id":"csv.integration","category":"integration","description":"Preview and summary counts match the actual exported file","hard":true,"requirement_ids":["R2","R4","R5","R6"]}],
      "runtime_requirements": ["Run offline from the delivered project", "Return a non-zero status for unusable input"],
      "visual_requirements": ["Human-readable console summary; a GUI is not required"],
      "delivery_requirements": ["Runnable package includes source, README, and test instructions"],
      "revision": {"revision_id":"REV_A_ADD_FIELD","change_type":"ADD_FEATURE","user_request":"在不改变现有清洗规则的前提下，为每次导出增加一份 JSON 格式的清洗统计报告。","acceptance":["JSON report contains counts that match the exported CSV","Existing CSV cleaning and malformed-input behavior remain correct"]}
    },
    {
      "case_id": "CASE_02_MARKDOWN_BATCH_CONVERTER", "level": "L1", "title": "Markdown Batch Converter",
      "user_goal": "做一个批量处理 Markdown 文档的小工具，可以读取一个目录，生成 HTML，保留标题、列表、代码块和链接，最后输出到另一个目录。",
      "allowed_assumptions": ["CommonMark-style Markdown", "Local files only", "Output may use a shared stylesheet"],
      "hard_requirements": [{"id":"R1","description":"Read multiple Markdown files from an input directory"},{"id":"R2","description":"Preserve headings, lists, code blocks, and links in HTML"},{"id":"R3","description":"Write converted files to a separate output directory"},{"id":"R4","description":"Repeat safely and report bad input"}],
      "hidden_acceptance": [{"id":"md.batch","category":"functional","description":"Multiple documents are converted","hard":true,"requirement_ids":["R1"]},{"id":"md.fidelity","category":"functional","description":"Headings, lists, links, and code remain semantically intact","hard":true,"requirement_ids":["R2"]},{"id":"md.errors","category":"functional","description":"Bad input is isolated and reported","hard":true,"requirement_ids":["R4"]},{"id":"md.runtime","category":"runtime","description":"Batch command executes on a clean local environment","hard":true,"requirement_ids":["R1"]},{"id":"md.persist","category":"persistence","description":"Generated pages remain usable after the converter process exits","hard":true,"requirement_ids":["R3"]},{"id":"md.integration","category":"integration","description":"Repeat runs produce consistent output-directory contents","hard":true,"requirement_ids":["R3","R4"]}],
      "runtime_requirements": ["One documented local command processes a folder"],
      "visual_requirements": ["Generated HTML is readable at desktop and mobile widths"],
      "delivery_requirements": ["Package includes examples, README, and test instructions"]
    },
    {
      "case_id": "CASE_03_LOCAL_PROJECT_BOARD", "level": "L2", "title": "Local Project Board",
      "user_goal": "做一个我自己本机使用的项目任务看板，可以创建、编辑、删除和移动任务，关闭以后重新打开数据还在，并且能把当前任务导出成 JSON。",
      "allowed_assumptions": ["Single local user", "Three fixed workflow columns", "JSON export is acceptable"],
      "hard_requirements": [{"id":"R1","description":"Create, edit, and delete task cards"},{"id":"R2","description":"Move cards through TODO, DOING, and DONE"},{"id":"R3","description":"Persist board data across restart"},{"id":"R4","description":"Export the board as JSON without losing fields"}],
      "hidden_acceptance": [{"id":"board.crud","category":"functional","description":"External actions exercise create, edit, and delete","hard":true,"requirement_ids":["R1"]},{"id":"board.move","category":"functional","description":"A card moves through the workflow","hard":true,"requirement_ids":["R2"]},{"id":"board.runtime","category":"runtime","description":"The local application responds over its documented interface","hard":true,"requirement_ids":["R1"]},{"id":"board.persist","category":"persistence","description":"State survives a fresh process","hard":true,"requirement_ids":["R3"]},{"id":"board.export","category":"integration","description":"Export matches stored card state","hard":true,"requirement_ids":["R4"]}],
      "runtime_requirements": ["Start locally without an external database", "State remains after a process restart"],
      "visual_requirements": ["Three columns and card actions are visibly distinguishable", "No overlapping controls at 1280x720"],
      "delivery_requirements": ["Runnable package includes source, README, and reset instructions"]
    },
    {
      "case_id": "CASE_04_PERSONAL_INVENTORY_MANAGER", "level": "L2", "title": "Personal Inventory Manager",
      "user_goal": "帮我做一个个人物品管理工具，记录物品名称、分类、数量、购买日期和备注，可以搜索和筛选，数量改变以后保存，还可以导出数据。",
      "allowed_assumptions": ["Single local user", "Quantity is a non-negative number", "CSV is the interchange format"],
      "hard_requirements": [{"id":"R1","description":"CRUD items with name, category, quantity, purchase date, and notes"},{"id":"R2","description":"Search and category-filter inventory"},{"id":"R3","description":"Persist quantity and other edits"},{"id":"R4","description":"Export the stored data"},{"id":"R5","description":"Reject invalid input"}],
      "hidden_acceptance": [{"id":"inventory.crud","category":"functional","description":"Requested item fields can be created, edited, and deleted","hard":true,"requirement_ids":["R1"]},{"id":"inventory.search","category":"functional","description":"Search and category filter return correct items","hard":true,"requirement_ids":["R2"]},{"id":"inventory.invalid","category":"functional","description":"Invalid quantity or field input is rejected","hard":true,"requirement_ids":["R5"]},{"id":"inventory.runtime","category":"runtime","description":"Application starts locally","hard":true,"requirement_ids":["R1"]},{"id":"inventory.persist","category":"persistence","description":"Quantity changes survive restart","hard":true,"requirement_ids":["R3"]},{"id":"inventory.export","category":"integration","description":"Export matches current stored values","hard":true,"requirement_ids":["R4"]}],
      "runtime_requirements": ["Local persistent storage", "Validation rejects negative quantities"],
      "visual_requirements": ["Inventory fields, search, filters, quantity changes, and export state are clear"],
      "delivery_requirements": ["Runnable package includes a sample CSV and README"]
    },
    {
      "case_id": "CASE_05_HOME_OPERATIONS_HUB", "level": "L5", "title": "Home Operations Hub",
      "user_goal": "帮我们家做一个本地使用的家庭事务管理工具。平时有杂事、重要资料和需要跟进的事情，希望不容易忘，也方便家人看懂。你自己设计第一版。",
      "allowed_assumptions": ["A small household shares one local installation", "No cloud account is required", "The product should explain its chosen organization model"],
      "hard_requirements": [{"id":"R1","description":"Turn the ambiguous request into a coherent household workflow"},{"id":"R2","description":"Preserve household records and follow-up state"},{"id":"R3","description":"Make pending and important items easy to understand"},{"id":"R4","description":"Avoid unrelated enterprise features and unnecessary complexity"}],
      "hidden_acceptance": [{"id":"home.coherence","category":"functional","description":"An unseen scenario can move from capture to understandable follow-up","hard":true,"requirement_ids":["R1","R3"]},{"id":"home.depth","category":"functional","description":"The product provides useful organization beyond a flat text list","hard":true,"requirement_ids":["R1","R3"]},{"id":"home.scope","category":"functional","description":"The first version stays local and proportionate without auth, cloud, or microservices","hard":true,"requirement_ids":["R4"]},{"id":"home.runtime","category":"runtime","description":"The chosen product starts and remains usable locally","hard":true,"requirement_ids":["R1"]},{"id":"home.persist","category":"persistence","description":"Records and follow-up state survive a fresh process","hard":true,"requirement_ids":["R2"]},{"id":"home.integration","category":"integration","description":"Capture, importance, and follow-up views operate on one state","hard":true,"requirement_ids":["R1","R2","R3"]}],
      "runtime_requirements": ["Run locally with durable state", "The evaluator may create an unseen multi-step household scenario"],
      "visual_requirements": ["The information hierarchy makes pending, important, and completed work understandable"],